{
  "schemaVersion": 1,
  "parentIssue": 216,
  "batchIssue": 429,
  "runtime": {
    "observedAt": "2026-05-15",
    "beyondVersion": "BEYOND 2030",
    "operatorSupervised": true,
    "noLaserConnected": true,
    "talkHost": "127.0.0.1",
    "talkPort": 16062,
    "oscListenHost": "0.0.0.0",
    "oscListenPort": 7000,
    "notes": "Readback-only probe against direct QShift.0 controls. This batch sent no writes and classifies lookup rows only."
  },
  "entries": [
    {
      "objectPath": "QShift.N.Action",
      "probePath": "QShift.0.Action",
      "probeMode": "readback-only",
      "valueType": "number",
      "baseline": {
        "value": 0,
        "typeTag": "f"
      },
      "evidenceNote": "Runtime readback-only evidence confirmed concrete direct QShift control path QShift.0.Action reads for normalized QShift.N.Action.",
      "locationAware": true,
      "locationContext": {
        "kind": "indexed-root",
        "populationDependent": false,
        "concreteContext": "QShift.0 direct control set",
        "notes": "Concrete reads used QShift.0 paths and normalized metadata keeps QShift.N placeholders."
      },
      "restore": {
        "strategy": "not-needed",
        "notes": "Readback-only probe sent no writes."
      }
    },
    {
      "objectPath": "QShift.N.Color",
      "probePath": "QShift.0.Color",
      "probeMode": "readback-only",
      "valueType": "number",
      "baseline": {
        "value": 6053017,
        "typeTag": "f"
      },
      "evidenceNote": "Runtime readback-only evidence confirmed concrete direct QShift control path QShift.0.Color reads for normalized QShift.N.Color.",
      "locationAware": true,
      "locationContext": {
        "kind": "indexed-root",
        "populationDependent": false,
        "concreteContext": "QShift.0 direct control set",
        "notes": "Concrete reads used QShift.0 paths and normalized metadata keeps QShift.N placeholders."
      },
      "restore": {
        "strategy": "not-needed",
        "notes": "Readback-only probe sent no writes."
      }
    },
    {
      "objectPath": "QShift.N.DivValue",
      "probePath": "QShift.0.DivValue",
      "probeMode": "readback-only",
      "valueType": "number",
      "baseline": {
        "value": 0,
        "typeTag": "f"
      },
      "evidenceNote": "Runtime readback-only evidence confirmed concrete direct QShift control path QShift.0.DivValue reads for normalized QShift.N.DivValue.",
      "locationAware": true,
      "locationContext": {
        "kind": "indexed-root",
        "populationDependent": false,
        "concreteContext": "QShift.0 direct control set",
        "notes": "Concrete reads used QShift.0 paths and normalized metadata keeps QShift.N placeholders."
      },
      "restore": {
        "strategy": "not-needed",
        "notes": "Readback-only probe sent no writes."
      }
    },
    {
      "objectPath": "QShift.N.ModValue",
      "probePath": "QShift.0.ModValue",
      "probeMode": "readback-only",
      "valueType": "number",
      "baseline": {
        "value": 0,
        "typeTag": "f"
      },
      "evidenceNote": "Runtime readback-only evidence confirmed concrete direct QShift control path QShift.0.ModValue reads for normalized QShift.N.ModValue.",
      "locationAware": true,
      "locationContext": {
        "kind": "indexed-root",
        "populationDependent": false,
        "concreteContext": "QShift.0 direct control set",
        "notes": "Concrete reads used QShift.0 paths and normalized metadata keeps QShift.N placeholders."
      },
      "restore": {
        "strategy": "not-needed",
        "notes": "Readback-only probe sent no writes."
      }
    },
    {
      "objectPath": "QShift.N.PhaseDir",
      "probePath": "QShift.0.PhaseDir",
      "probeMode": "readback-only",
      "valueType": "number",
      "baseline": {
        "value": -100,
        "typeTag": "f"
      },
      "evidenceNote": "Runtime readback-only evidence confirmed concrete direct QShift control path QShift.0.PhaseDir reads for normalized QShift.N.PhaseDir.",
      "locationAware": true,
      "locationContext": {
        "kind": "indexed-root",
        "populationDependent": false,
        "concreteContext": "QShift.0 direct control set",
        "notes": "Concrete reads used QShift.0 paths and normalized metadata keeps QShift.N placeholders."
      },
      "restore": {
        "strategy": "not-needed",
        "notes": "Readback-only probe sent no writes."
      }
    },
    {
      "objectPath": "QShift.N.Width",
      "probePath": "QShift.0.Width",
      "probeMode": "readback-only",
      "valueType": "number",
      "baseline": {
        "value": 1,
        "typeTag": "f"
      },
      "evidenceNote": "Runtime readback-only evidence confirmed concrete direct QShift control path QShift.0.Width reads for normalized QShift.N.Width.",
      "locationAware": true,
      "locationContext": {
        "kind": "indexed-root",
        "populationDependent": false,
        "concreteContext": "QShift.0 direct control set",
        "notes": "Concrete reads used QShift.0 paths and normalized metadata keeps QShift.N placeholders."
      },
      "restore": {
        "strategy": "not-needed",
        "notes": "Readback-only probe sent no writes."
      }
    }
  ]
}
